<?xml version="1.0" encoding="UTF-8"?>
<!DOCTYPE Reggio SYSTEM "Reggio.dtd">

<Reggio>
	<establecimiento>
		<pedido cod_pedido="A180001-22" tipo="URGENTE">
				<datos>
					<nombre>Lucas</nombre>
					<direccion_envio>
						<Via>Calle molina</Via>
						<numero>8</numero>
						<localidad>Rincón de la victoria</localidad>
						<provincia>Málaga</provincia>
						<cp>29730</cp>
					</direccion_envio>
					<direccion_almacen>
						<Via>Calle muelles</Via>
						<numero>2</numero>
						<localidad>Rincón de la victoria</localidad>
						<provincia>Málaga</provincia>
						<cp>29730</cp>
					</direccion_almacen>
				</datos>
				<nombre_empleado>David</nombre_empleado>
				<fecha>2022-04-22</fecha>
				<articulos cod_articulo="ABC123">
					<cantidad>8</cantidad>
					<precio moneda="EUR">8.80</precio>
					<observaciones>Cuidado es frágil</observaciones>
				</articulos>
		</pedido>
		<tienda pedido_ref="A180001-22">
			<albaran estado="RECIBIDO">
				<fecha>2022-12-12</fecha>
				<observaciones>Falta un producto</observaciones>
			</albaran>
			<pago estado="PAGADO" fecha="2022-12-15"/>
		</tienda>
		<almacen id_almacen="B123" pedido_ref="A180001-22" estado="RECIBIDO"/>
	</establecimiento>
</Reggio>